{
  "mutation_id": "018e1234-5678-7abc-8def-0123456789ab",
  "strategy_id": "M01",
  "parent_candidate_id": "018e9999-aaaa-7bbb-8ccc-ddddeeeeffff",
  "seed": 1,
  "operator_name": "example",
  "target_ast_location": {
    "file_path": "example",
    "lineno": 2,
    "col_offset": 1
  },
  "created_at": "2026-08-19T12:00:00.000000Z"
}
